{
  "$schema": "http://json-schema.org/draft-04/schema#",
  "title": "TY 2026-27 onwards",
  "type": "object",
  "properties": {
    "submittedOn": {"$ref": "../../other_definitions.json#/definitions/submittedOn"},
    "postCessationReceipts": {"$ref": "../../other_definitions.json#/definitions/postCessationReceipts"},
    "allOtherIncomeReceivedWhilstAbroad": {"$ref": "../../other_definitions.json#/definitions/allOtherIncomeReceivedWhilstAbroad"},
    "overseasIncomeAndGains": {"$ref": "../../other_definitions.json#/definitions/overseasIncomeAndGains"},
    "chargeableForeignBenefitsAndGifts": {"$ref": "../../other_definitions.json#/definitions/chargeableForeignBenefitsAndGifts"},
    "omittedForeignIncome": {"$ref": "../../other_definitions.json#/definitions/omittedForeignIncome"},
    "benefitFromPreOwnedAssets": {"$ref": "../../other_definitions.json#/definitions/benefitFromPreOwnedAssets"},
    "additionalIncome": {
      "type": "object",
      "description": "The container that holds details of additional taxable income.",
      "properties": {
        "propertyIncomeDistributions": {
          "description": "The container that holds the key value for Property Income Distributions (PIDs) from Real Estate Investment Trusts (REITs) and Property Authorised Investment Funds (PAIFs).",
          "allOf": [
            {
              "$ref": "../../other_definitions.json#/definitions/additionalIncomeBreakdown"
            }
          ]
        },
        "personalInsuranceBenefits": {
          "description": "The container that holds the key value for personal insurance benefits.",
          "allOf": [
            {
              "$ref": "../../other_definitions.json#/definitions/additionalIncomeBreakdown"
            }
          ]
        },
        "incomeFromUnauthorisedUnitTrust": {
          "description": "The container that holds the key value for income from unauthorised unit trusts.",
          "allOf": [
            {
              "$ref": "../../other_definitions.json#/definitions/additionalIncomeBreakdown"
            }
          ]
        },
        "profitsFromCertificateOfDeposit": {
          "description": "The container that holds the key value for profits from certificates of deposit.",
          "allOf": [
            {
              "$ref": "../../other_definitions.json#/definitions/additionalIncomeBreakdown"
            }
          ]
        },
        "nonCashBenefitsFromFormerEmployer": {
          "description": "The container that holds the key value for non-cash benefits received from a former employer.",
          "allOf": [
              {
              "$ref": "../../other_definitions.json#/definitions/additionalIncomeBreakdown"
              }
          ]
        },
        "authorisedPaymentsFromOverseasPensionScheme": {
          "description": "The container that holds the key value for authorised payments from overseas pension schemes.",
          "allOf": [
            {
              "$ref": "../../other_definitions.json#/definitions/additionalIncomeBreakdown"
            }
          ]
        },
        "taxableAnnualPayments": {
          "description": "The container that holds the key value for taxable annual payments.",
          "allOf": [
            {
              "$ref": "../../other_definitions.json#/definitions/additionalIncomeBreakdown"
            }
          ]
        },
        "miscellaneousIncome": {
          "description": "The container that holds the key value for miscellaneous income.",
          "allOf": [
            {
            "$ref": "../../other_definitions.json#/definitions/additionalIncomeBreakdown"
            }
          ]
        }
      },
      "additionalProperties": false
    }
  },
  "required": ["submittedOn"]
}
